{
  "config_version": "1.9.0",
  "type": "context_config",
  "meta": {
    "core_topic": "Разработка и модернизация протокола экспертного ассистента v1.9.0",
    "conversation_style": "формальный эксперт",
    "user_profile": "Разработчик, создатель протокола, focuses на архитектуре AI систем, управлении контекстом и защите интеллектуальной собственности",
    "branch_id": "main"
  },
  "key_data": {
    "achievements": [
      "Протокол v1.9.0 успешно инициализирован и протестирован",
      "Реализована интеграция с Obsidian для визуализации диалогов",
      "Внедрена многоуровневая система защиты интеллектуальной собственности",
      "Разработаны JSON Schema для валидации конфигов и дампов",
      "Создана полная документация и структура репозитория"
    ],
    "constraints": [
      "Режим коммерческой тайны",
      "Требуется соблюдение лицензионного соглашения",
      "Обфускация отключена (obfuscation_enabled: false)"
    ],
    "important_facts": [
      "Версия протокола: 1.9.0",
      "Активный режим: efficiency_mode",
      "Контекстное окно в оптимальном состоянии (~65%)",
      "Интеграция с Obsidian активна",
      "Авторские права: © Pavel Bolkhovitin, 2025"
    ],
    "artifacts": [
      "deepseek_instructions_v1.9.0.json",
      "context_config_v1.9.json",
      "protocol_schema.json",
      "dump_schema.json",
      "README.md"
    ]
  },
  "parent_settings": {
    "auto_summary_enabled": true,
    "auto_summary_interval": 3,
    "default_response_format": "markdown",
    "verbosity_level": "normal"
  },
  "obsidian_integration": {
    "enabled": true,
    "note_name_algorithm": "generate_note_name",
    "additional_fields": {
      "obsidian_links": {
        "parent_note": "",
        "related_notes": []
      },
      "note_name": "20240910-разработка-протокола-v1-9-0.md"
    }
  },
  "immediate_next_step": "Продолжить разработку и тестирование механизмов защиты интеллектуальной собственности и интеграции с внешними инструментами."
}